00:34:51.117943 IP lin.48390 > 36.152.44.95.https: Flags [S], seq 652214363, win 64240, options [mss 1460,sackOK,TS val 3027973085 ecr 0,nop,wscale 7], length 0
00:34:51.117991 IP lin.48392 > 36.152.44.95.https: Flags [S], seq 2341726925, win 64240, options [mss 1460,sackOK,TS val 3027973085 ecr 0,nop,wscale 7], length 0
00:34:51.134848 IP 36.152.44.95.https > lin.48390: Flags [S.], seq 3359203213, ack 652214364, win 8192, options [mss 1412,sackOK,nop,nop,nop,nop,nop,nop,nop,nop,nop,nop,nop,wscale 5], length 0
00:34:51.134872 IP lin.48390 > 36.152.44.95.https: Flags [.], ack 1, win 502, length 0
00:34:51.135150 IP lin.48390 > 36.152.44.95.https: Flags [P.], seq 1:518, ack 1, win 502, length 517
00:34:51.136625 IP 36.152.44.95.https > lin.48392: Flags [S.], seq 977236388, ack 2341726926, win 8192, options [mss 1412,sackOK,nop,nop,nop,nop,nop,nop,nop,nop,nop,nop,nop,wscale 5], length 0
00:34:51.136668 IP lin.48392 > 36.152.44.95.https: Flags [.], ack 1, win 502, length 0
00:34:51.136928 IP lin.48392 > 36.152.44.95.https: Flags [P.], seq 1:518, ack 1, win 502, length 517
00:34:51.146995 IP 36.152.44.95.https > lin.48390: Flags [P.], seq 1:97, ack 518, win 944, length 96
00:34:51.147026 IP lin.48390 > 36.152.44.95.https: Flags [.], ack 97, win 502, length 0
00:34:51.147471 IP 36.152.44.95.https > lin.48390: Flags [P.], seq 97:103, ack 518, win 944, length 6
00:34:51.147481 IP lin.48390 > 36.152.44.95.https: Flags [.], ack 103, win 502, length 0
00:34:51.147899 IP 36.152.44.95.https > lin.48390: Flags [P.], seq 103:148, ack 518, win 944, length 45
00:34:51.147910 IP lin.48390 > 36.152.44.95.https: Flags [.], ack 148, win 502, length 0
00:34:51.148144 IP lin.48390 > 36.152.44.95.https: Flags [P.], seq 518:569, ack 148, win 502, length 51
00:34:51.152327 IP 36.152.44.95.https > lin.48392: Flags [P.], seq 1:97, ack 518, win 944, length 96
00:34:51.152347 IP lin.48392 > 36.152.44.95.https: Flags [.], ack 97, win 502, length 0
00:34:51.153008 IP 36.152.44.95.https > lin.48392: Flags [P.], seq 97:103, ack 518, win 944, length 6
00:34:51.153052 IP lin.48392 > 36.152.44.95.https: Flags [.], ack 103, win 502, length 0
00:34:51.153060 IP 36.152.44.95.https > lin.48392: Flags [P.], seq 103:148, ack 518, win 944, length 45
00:34:51.153064 IP lin.48392 > 36.152.44.95.https: Flags [.], ack 148, win 502, length 0
00:34:51.153531 IP lin.48392 > 36.152.44.95.https: Flags [P.], seq 518:569, ack 148, win 502, length 51
00:34:51.159811 IP 36.152.44.95.https > lin.48390: Flags [.], ack 518, win 944, length 0
00:34:51.159860 IP lin.48390 > 36.152.44.95.https: Flags [.], ack 148, win 502, length 0
00:34:51.159889 IP 36.152.44.95.https > lin.48392: Flags [.], ack 518, win 944, length 0
00:34:51.159901 IP lin.48392 > 36.152.44.95.https: Flags [.], ack 148, win 502, length 0
00:34:51.161158 IP 36.152.44.95.https > lin.48390: Flags [P.], seq 103:148, ack 518, win 944, length 45
00:34:51.161210 IP lin.48390 > 36.152.44.95.https: Flags [.], ack 148, win 502, options [nop,nop,sack 1 {103:148}], length 0
00:34:51.162156 IP 36.152.44.95.https > lin.48392: Flags [P.], seq 103:148, ack 518, win 944, length 45
00:34:51.162190 IP lin.48392 > 36.152.44.95.https: Flags [.], ack 148, win 502, options [nop,nop,sack 1 {103:148}], length 0
00:34:51.166082 IP 36.152.44.95.https > lin.48390: Flags [.], ack 569, win 944, length 0
00:34:51.176096 IP 36.152.44.95.https > lin.48392: Flags [.], ack 569, win 944, length 0
00:34:51.587964 IP lin.48390 > 36.152.44.95.https: Flags [.], seq 569:1981, ack 148, win 502, length 1412
00:34:51.587983 IP lin.48390 > 36.152.44.95.https: Flags [P.], seq 1981:2890, ack 148, win 502, length 909
00:34:51.607524 IP 36.152.44.95.https > lin.48390: Flags [.], ack 2890, win 1088, length 0
00:34:51.699584 IP 36.152.44.95.https > lin.48390: Flags [.], seq 148:1560, ack 2890, win 1088, length 1412
00:34:51.699635 IP lin.48390 > 36.152.44.95.https: Flags [.], ack 1560, win 501, length 0
00:34:51.699921 IP 36.152.44.95.https > lin.48390: Flags [.], seq 1560:2972, ack 2890, win 1088, length 1412
00:34:51.699947 IP lin.48390 > 36.152.44.95.https: Flags [.], ack 2972, win 501, length 0
00:34:51.700839 IP 36.152.44.95.https > lin.48390: Flags [P.], seq 2972:4177, ack 2890, win 1088, length 1205
00:34:51.700864 IP lin.48390 > 36.152.44.95.https: Flags [.], ack 4177, win 501, length 0
00:34:51.700892 IP 36.152.44.95.https > lin.48390: Flags [P.], seq 4177:4302, ack 2890, win 1088, length 125
00:34:51.700905 IP lin.48390 > 36.152.44.95.https: Flags [.], ack 4302, win 501, length 0
00:34:51.700911 IP 36.152.44.95.https > lin.48390: Flags [P.], seq 4302:4332, ack 2890, win 1088, length 30
00:34:51.700918 IP lin.48390 > 36.152.44.95.https: Flags [.], ack 4332, win 501, length 0
00:34:51.700924 IP 36.152.44.95.https > lin.48390: Flags [P.], seq 4332:8361, ack 2890, win 1088, length 4029
00:34:51.700932 IP lin.48390 > 36.152.44.95.https: Flags [.], ack 8361, win 470, length 0
00:34:51.700937 IP 36.152.44.95.https > lin.48390: Flags [P.], seq 8361:8486, ack 2890, win 1088, length 125
00:34:51.700944 IP lin.48390 > 36.152.44.95.https: Flags [.], ack 8486, win 470, length 0
00:34:51.700949 IP 36.152.44.95.https > lin.48390: Flags [.], seq 8486:9898, ack 2890, win 1088, length 1412
00:34:51.700955 IP lin.48390 > 36.152.44.95.https: Flags [.], ack 9898, win 459, length 0
00:34:51.701701 IP 36.152.44.95.https > lin.48390: Flags [P.], seq 9898:10748, ack 2890, win 1088, length 850
00:34:51.701728 IP lin.48390 > 36.152.44.95.https: Flags [.], ack 10748, win 501, length 0
00:34:51.701747 IP 36.152.44.95.https > lin.48390: Flags [P.], seq 10748:14777, ack 2890, win 1088, length 4029
00:34:51.701756 IP lin.48390 > 36.152.44.95.https: Flags [.], ack 14777, win 473, length 0
00:34:51.701762 IP 36.152.44.95.https > lin.48390: Flags [P.], seq 14777:14901, ack 2890, win 1088, length 124
00:34:51.701768 IP lin.48390 > 36.152.44.95.https: Flags [.], ack 14901, win 473, length 0
00:34:51.701774 IP 36.152.44.95.https > lin.48390: Flags [P.], seq 14901:18930, ack 2890, win 1088, length 4029
00:34:51.701780 IP lin.48390 > 36.152.44.95.https: Flags [.], ack 18930, win 442, length 0
00:34:51.702507 IP 36.152.44.95.https > lin.48390: Flags [P.], seq 18930:19055, ack 2890, win 1088, length 125
00:34:51.702534 IP lin.48390 > 36.152.44.95.https: Flags [.], ack 19055, win 442, length 0
00:34:51.702563 IP 36.152.44.95.https > lin.48390: Flags [.], seq 19055:28939, ack 2890, win 1088, length 9884
00:34:51.702579 IP lin.48390 > 36.152.44.95.https: Flags [.], ack 28939, win 365, length 0
00:34:51.703192 IP 36.152.44.95.https > lin.48390: Flags [.], seq 28939:30351, ack 2890, win 1088, length 1412
00:34:51.703219 IP lin.48390 > 36.152.44.95.https: Flags [.], ack 30351, win 354, length 0
00:34:51.710098 IP 36.152.44.95.https > lin.48390: Flags [.], seq 30351:31763, ack 2890, win 1088, length 1412
00:34:51.710154 IP lin.48390 > 36.152.44.95.https: Flags [.], ack 31763, win 501, length 0
00:34:51.714357 IP 36.152.44.95.https > lin.48390: Flags [.], seq 31763:33175, ack 2890, win 1088, length 1412
00:34:51.714605 IP 36.152.44.95.https > lin.48390: Flags [.], seq 33175:34587, ack 2890, win 1088, length 1412
00:34:51.714634 IP lin.48390 > 36.152.44.95.https: Flags [.], ack 34587, win 501, length 0
00:34:51.716272 IP 36.152.44.95.https > lin.48390: Flags [.], seq 34587:45883, ack 2890, win 1088, length 11296
00:34:51.716430 IP lin.48390 > 36.152.44.95.https: Flags [.], ack 45883, win 501, length 0
00:34:51.717173 IP 36.152.44.95.https > lin.48390: Flags [.], seq 45883:57179, ack 2890, win 1088, length 11296
00:34:51.717325 IP lin.48390 > 36.152.44.95.https: Flags [.], ack 57179, win 501, length 0
00:34:51.718625 IP 36.152.44.95.https > lin.48390: Flags [.], seq 57179:68475, ack 2890, win 1088, length 11296
00:34:51.718730 IP 36.152.44.95.https > lin.48390: Flags [.], seq 68475:69887, ack 2890, win 1088, length 1412
00:34:51.718745 IP lin.48390 > 36.152.44.95.https: Flags [.], ack 68475, win 501, length 0
00:34:51.718770 IP lin.48390 > 36.152.44.95.https: Flags [.], ack 69887, win 524, length 0
00:34:51.724618 IP 36.152.44.95.https > lin.48390: Flags [.], seq 69887:71299, ack 2890, win 1088, length 1412
00:34:51.724646 IP lin.48390 > 36.152.44.95.https: Flags [.], ack 71299, win 547, length 0
00:34:51.725311 IP 36.152.44.95.https > lin.48390: Flags [.], seq 71299:72711, ack 2890, win 1088, length 1412
00:34:51.725323 IP lin.48390 > 36.152.44.95.https: Flags [.], ack 72711, win 570, length 0
00:34:51.726120 IP 36.152.44.95.https > lin.48390: Flags [P.], seq 72711:79426, ack 2890, win 1088, length 6715
00:34:51.726143 IP lin.48390 > 36.152.44.95.https: Flags [.], ack 79426, win 674, length 0
00:34:52.119425 IP lin.48400 > 36.152.44.95.https: Flags [S], seq 3812961774, win 64240, options [mss 1460,sackOK,TS val 3027974086 ecr 0,nop,wscale 7], length 0
00:34:52.122603 IP lin.48402 > 36.152.44.95.https: Flags [S], seq 2037428804, win 64240, options [mss 1460,sackOK,TS val 3027974090 ecr 0,nop,wscale 7], length 0
00:34:52.130401 IP 36.152.44.95.https > lin.48400: Flags [S.], seq 2157841091, ack 3812961775, win 8192, options [mss 1412,sackOK,nop,nop,nop,nop,nop,nop,nop,nop,nop,nop,nop,wscale 5], length 0
00:34:52.130426 IP lin.48400 > 36.152.44.95.https: Flags [.], ack 1, win 502, length 0
00:34:52.130580 IP lin.48400 > 36.152.44.95.https: Flags [P.], seq 1:518, ack 1, win 502, length 517
00:34:52.135805 IP 36.152.44.95.https > lin.48402: Flags [S.], seq 1248912502, ack 2037428805, win 8192, options [mss 1412,sackOK,nop,nop,nop,nop,nop,nop,nop,nop,nop,nop,nop,wscale 5], length 0
00:34:52.135831 IP lin.48402 > 36.152.44.95.https: Flags [.], ack 1, win 502, length 0
00:34:52.136045 IP lin.48402 > 36.152.44.95.https: Flags [P.], seq 1:518, ack 1, win 502, length 517
00:34:52.145477 IP 36.152.44.95.https > lin.48400: Flags [P.], seq 1:97, ack 518, win 944, length 96
00:34:52.145503 IP lin.48400 > 36.152.44.95.https: Flags [.], ack 97, win 502, length 0
00:34:52.145692 IP 36.152.44.95.https > lin.48400: Flags [P.], seq 97:103, ack 518, win 944, length 6
00:34:52.145700 IP lin.48400 > 36.152.44.95.https: Flags [.], ack 103, win 502, length 0
00:34:52.145880 IP 36.152.44.95.https > lin.48400: Flags [P.], seq 103:148, ack 518, win 944, length 45
00:34:52.145888 IP lin.48400 > 36.152.44.95.https: Flags [.], ack 148, win 502, length 0
00:34:52.145893 IP 36.152.44.95.https > lin.48400: Flags [.], ack 518, win 944, length 0
00:34:52.145896 IP lin.48400 > 36.152.44.95.https: Flags [.], ack 148, win 502, length 0
00:34:52.146343 IP lin.48400 > 36.152.44.95.https: Flags [P.], seq 518:569, ack 148, win 502, length 51
00:34:52.146505 IP lin.48400 > 36.152.44.95.https: Flags [.], seq 569:1981, ack 148, win 502, length 1412
00:34:52.146509 IP lin.48400 > 36.152.44.95.https: Flags [P.], seq 1981:3116, ack 148, win 502, length 1135
00:34:52.148047 IP 36.152.44.95.https > lin.48402: Flags [P.], seq 1:97, ack 518, win 944, length 96
00:34:52.148061 IP lin.48402 > 36.152.44.95.https: Flags [.], ack 97, win 502, length 0
00:34:52.148270 IP 36.152.44.95.https > lin.48402: Flags [P.], seq 97:103, ack 518, win 944, length 6
00:34:52.148276 IP lin.48402 > 36.152.44.95.https: Flags [.], ack 103, win 502, length 0
00:34:52.148462 IP 36.152.44.95.https > lin.48402: Flags [P.], seq 103:148, ack 518, win 944, length 45
00:34:52.148472 IP lin.48402 > 36.152.44.95.https: Flags [.], ack 148, win 502, length 0
00:34:52.149058 IP lin.48402 > 36.152.44.95.https: Flags [P.], seq 518:569, ack 148, win 502, length 51
00:34:52.149222 IP lin.48402 > 36.152.44.95.https: Flags [.], seq 569:1981, ack 148, win 502, length 1412
00:34:52.149227 IP lin.48402 > 36.152.44.95.https: Flags [P.], seq 1981:3106, ack 148, win 502, length 1125
00:34:52.154001 IP 36.152.44.95.https > lin.48400: Flags [P.], seq 103:148, ack 518, win 944, length 45
00:34:52.154018 IP lin.48400 > 36.152.44.95.https: Flags [.], ack 148, win 502, options [nop,nop,sack 1 {103:148}], length 0
00:34:52.157511 IP 36.152.44.95.https > lin.48402: Flags [.], ack 518, win 944, length 0
00:34:52.157534 IP lin.48402 > 36.152.44.95.https: Flags [.], ack 148, win 502, length 0
00:34:52.157776 IP 36.152.44.95.https > lin.48402: Flags [P.], seq 103:148, ack 518, win 944, length 45
00:34:52.157784 IP lin.48402 > 36.152.44.95.https: Flags [.], ack 148, win 502, options [nop,nop,sack 1 {103:148}], length 0
00:34:52.164884 IP 36.152.44.95.https > lin.48402: Flags [P.], seq 148:447, ack 3106, win 1120, length 299
00:34:52.164901 IP lin.48402 > 36.152.44.95.https: Flags [.], ack 447, win 501, length 0
00:34:52.165822 IP 36.152.44.95.https > lin.48400: Flags [.], ack 569, win 944, length 0
00:34:52.165835 IP 36.152.44.95.https > lin.48400: Flags [.], ack 3116, win 1104, length 0
00:34:52.165839 IP 36.152.44.95.https > lin.48402: Flags [.], ack 569, win 944, length 0
00:34:52.165841 IP 36.152.44.95.https > lin.48402: Flags [.], ack 1981, win 1032, length 0
00:34:52.165859 IP 36.152.44.95.https > lin.48402: Flags [.], ack 3106, win 1120, length 0
00:34:52.180440 IP 36.152.44.95.https > lin.48400: Flags [P.], seq 148:526, ack 3116, win 1104, length 378
00:34:52.180459 IP lin.48400 > 36.152.44.95.https: Flags [.], ack 526, win 501, length 0
00:34:52.220268 IP lin.48390 > 36.152.44.95.https: Flags [.], seq 2890:4302, ack 79426, win 674, length 1412
00:34:52.220286 IP lin.48390 > 36.152.44.95.https: Flags [.], seq 4302:5714, ack 79426, win 674, length 1412
00:34:52.220289 IP lin.48390 > 36.152.44.95.https: Flags [P.], seq 5714:6089, ack 79426, win 674, length 375
00:34:52.235236 IP 36.152.44.95.https > lin.48390: Flags [.], ack 4302, win 1176, length 0
00:34:52.235252 IP 36.152.44.95.https > lin.48390: Flags [.], ack 6089, win 1288, length 0
00:34:52.241485 IP 36.152.44.95.https > lin.48390: Flags [P.], seq 79426:79625, ack 6089, win 1288, length 199
00:34:52.241498 IP lin.48390 > 36.152.44.95.https: Flags [.], ack 79625, win 697, length 0
00:34:52.323235 IP lin.48390 > 36.152.44.95.https: Flags [.], seq 6089:7501, ack 79625, win 697, length 1412
00:34:52.323253 IP lin.48390 > 36.152.44.95.https: Flags [P.], seq 7501:8451, ack 79625, win 697, length 950
00:34:52.331453 IP lin.48392 > 36.152.44.95.https: Flags [.], seq 569:1981, ack 148, win 502, length 1412
00:34:52.331482 IP lin.48392 > 36.152.44.95.https: Flags [P.], seq 1981:2939, ack 148, win 502, length 958
00:34:52.345379 IP 36.152.44.95.https > lin.48390: Flags [.], ack 8451, win 1436, length 0
00:34:52.345395 IP 36.152.44.95.https > lin.48392: Flags [.], ack 2939, win 1092, length 0
00:34:52.354816 IP 36.152.44.95.https > lin.48392: Flags [P.], seq 148:491, ack 2939, win 1092, length 343
00:34:52.354835 IP lin.48392 > 36.152.44.95.https: Flags [.], ack 491, win 501, length 0
00:34:52.371641 IP 36.152.44.95.https > lin.48390: Flags [P.], seq 79625:79999, ack 8451, win 1436, length 374
00:34:52.371671 IP lin.48390 > 36.152.44.95.https: Flags [.], ack 79999, win 719, length 0
00:34:53.256325 IP lin.48406 > 36.152.44.95.https: Flags [S], seq 896933089, win 64240, options [mss 1460,sackOK,TS val 3027975223 ecr 0,nop,wscale 7], length 0
00:34:53.267482 IP 36.152.44.95.https > lin.48406: Flags [S.], seq 2412525932, ack 896933090, win 8192, options [mss 1412,sackOK,nop,nop,nop,nop,nop,nop,nop,nop,nop,nop,nop,wscale 5], length 0
00:34:53.267572 IP lin.48406 > 36.152.44.95.https: Flags [.], ack 1, win 502, length 0
00:34:53.268151 IP lin.48406 > 36.152.44.95.https: Flags [P.], seq 1:518, ack 1, win 502, length 517
00:34:53.283796 IP 36.152.44.95.https > lin.48406: Flags [P.], seq 1:97, ack 518, win 944, length 96
00:34:53.283844 IP lin.48406 > 36.152.44.95.https: Flags [.], ack 97, win 502, length 0
00:34:53.284192 IP 36.152.44.95.https > lin.48406: Flags [P.], seq 97:103, ack 518, win 944, length 6
00:34:53.284229 IP lin.48406 > 36.152.44.95.https: Flags [.], ack 103, win 502, length 0
00:34:53.284257 IP 36.152.44.95.https > lin.48406: Flags [P.], seq 103:148, ack 518, win 944, length 45
00:34:53.284273 IP lin.48406 > 36.152.44.95.https: Flags [.], ack 148, win 502, length 0
00:34:53.284887 IP 36.152.44.95.https > lin.48406: Flags [.], ack 518, win 944, length 0
00:34:53.284922 IP lin.48406 > 36.152.44.95.https: Flags [.], ack 148, win 502, length 0
00:34:53.286177 IP lin.48406 > 36.152.44.95.https: Flags [P.], seq 518:569, ack 148, win 502, length 51
00:34:53.286551 IP lin.48406 > 36.152.44.95.https: Flags [.], seq 569:1981, ack 148, win 502, length 1412
00:34:53.286567 IP lin.48406 > 36.152.44.95.https: Flags [P.], seq 1981:3153, ack 148, win 502, length 1172
00:34:53.291119 IP 36.152.44.95.https > lin.48406: Flags [P.], seq 103:148, ack 518, win 944, length 45
00:34:53.291162 IP lin.48406 > 36.152.44.95.https: Flags [.], ack 148, win 502, options [nop,nop,sack 1 {103:148}], length 0
00:34:53.307734 IP 36.152.44.95.https > lin.48406: Flags [.], ack 569, win 944, length 0
00:34:53.307761 IP 36.152.44.95.https > lin.48406: Flags [.], ack 1981, win 1032, length 0
00:34:53.307768 IP 36.152.44.95.https > lin.48406: Flags [.], ack 3153, win 1120, length 0
00:34:53.320192 IP 36.152.44.95.https > lin.48406: Flags [P.], seq 148:526, ack 3153, win 1120, length 378
00:34:53.320212 IP lin.48406 > 36.152.44.95.https: Flags [.], ack 526, win 501, length 0

